{"apiVersion":"bugate.io/v2","digest":"sha256:84a6234d35b48b71f1e702a024e2fb8e944f1289e94e6bd371a1323174a77ccd","id":"dsh-request-cf7bed1701cefe1fe9cdf3825d67878c","kind":"ScopeRequest","message":"R1: Positive integers retain their value; zero and negative integers produce zero. K1: Negative boundary.\nAccept only these explicitly requested positive and negative branches. Record unrelated risks as suggestions.","origin":"user","session_id":"scope-false","source_event_id":"ee585a5c-e3d4-4cc3-9f08-63d401853f16","task_id":"same-task","workspace_id":"sha256:f5a07389ea291400fc6c78a0f58df92724dd509870d419c3aca5db5596d6a4b6"}
