{"apiVersion":"bugate.io/v2","digest":"sha256:f15a1215f6443c498b6412328262c7e278083e80b5a70b7e66f27b6522c8a2c7","id":"dsh-request-f5fafebcfd5a16bf708ab58098c64d98","kind":"ScopeRequest","message":"Read the bound source, establish business Oracles, record and assess pre-code design.","origin":"user","session_id":"installed-runtime","source_event_id":"4083b5ae-d052-4d1f-b714-0160051b3445","task_id":"same-task","workspace_id":"sha256:cdfdb32e721f3faffef5ba403eebe28f0a19a1fb81d2b00dd530e8962c65c9e2"}
