{"apiVersion":"bugate.io/v2","digest":"sha256:30963ae1d4ccb6f98df5c803229bc375ece12926ed92fbc7ad75fa87109e867a","id":"dsh-request-f22416d3acbb38b4fbd5f7ecddb835af","kind":"ScopeRequest","message":"Record these out-of-scope ideas as suggestions and finish the same agreed acceptance.","origin":"user","session_id":"installed-runtime","source_event_id":"fb14070e-6dd0-4520-8020-791ade760291","task_id":"same-task","workspace_id":"sha256:cdfdb32e721f3faffef5ba403eebe28f0a19a1fb81d2b00dd530e8962c65c9e2"}
