{"apiVersion":"bugate.io/v2","digest":"sha256:dd1f17233031f57c3265d7b5aa308fcc2aacc0d1073bdf37d7da25946df63891","id":"dsh-request-a022a5195c4537ec47b94518326e3e47","kind":"ScopeRequest","message":"Assess the executed requirement against this exact current snapshot and observed case results.","origin":"user","session_id":"installed-runtime","source_event_id":"defcee00-2b84-4981-a913-01bf7801d4bd","task_id":"same-task","workspace_id":"sha256:cdfdb32e721f3faffef5ba403eebe28f0a19a1fb81d2b00dd530e8962c65c9e2"}
