{"apiVersion":"bugate.io/v2","digest":"sha256:5512a9912f6248fc63fd5a44ed81a9aaa0e3d594c4df8f2350eeed16327a9563","id":"dsh-request-f52943a74f59e5b8193fc65988374226","kind":"ScopeRequest","message":"Implement the accepted cases and execute only the configured in-scope tests.","origin":"user","session_id":"installed-runtime","source_event_id":"fa776bf5-a8a3-4cc2-87bd-aed4ec73735a","task_id":"same-task","workspace_id":"sha256:cdfdb32e721f3faffef5ba403eebe28f0a19a1fb81d2b00dd530e8962c65c9e2"}
