{"apiVersion":"bugate.io/v2","digest":"sha256:773873589e97baa6613c4f209f28ff4afb65d44dfc4ab7b76072fba847d084c2","id":"dsh-request-427ff2a1124636018df92bfb6d0e20f3","kind":"ScopeRequest","message":"R1: Positive integers retain their value; zero and negative integers produce zero. K1: Negative boundary.\nAccept only these explicitly requested positive and negative branches. Record unrelated risks as suggestions.","origin":"user","session_id":"scope-false","source_event_id":"6e4cf1a9-0afd-45d5-bc91-960e1a0e7ade","task_id":"same-task","workspace_id":"sha256:144734d933fb9d031f58be85e71995b6bbd9917668e582e753c2963ce10245ca"}
