{"apiVersion":"bugate.io/v2","digest":"sha256:3ead33d59fdf9a100e16613443e7fea849405b1d488fa57d3488202b2a0ae454","id":"dsh-request-6d5259a6598a640f925cff0c8afaddfe","kind":"ScopeRequest","message":"R1: Positive integers retain their value; zero and negative integers produce zero. K1: Negative boundary.\nAccept only these explicitly requested positive and negative branches. Record unrelated risks as suggestions.","origin":"user","session_id":"installed-runtime","source_event_id":"42e54a06-79aa-4a9e-b667-8d28b191d13b","task_id":"same-task","workspace_id":"sha256:cdfdb32e721f3faffef5ba403eebe28f0a19a1fb81d2b00dd530e8962c65c9e2"}
