{"apiVersion":"bugate.io/v2","digest":"sha256:9e92954f5db8fcb240627c492238de941e4e1c819d615568cdd18ec3425db2af","id":"dsh-request-247ca4ff180596cd9f289db2fe5b7e60","kind":"ScopeRequest","message":"Assess whether the agreed acceptance execution is complete.","origin":"user","session_id":"installed-runtime","source_event_id":"87366e87-64ef-4e38-9db9-41ce8244400f","task_id":"same-task","workspace_id":"sha256:cdfdb32e721f3faffef5ba403eebe28f0a19a1fb81d2b00dd530e8962c65c9e2"}
