{"apiVersion":"bugate.io/v2","digest":"sha256:001ad4ec0e8ce4dbaf040e9471cf0f5765565ea0f6c80f660d52955a1b5fa4b2","id":"dsh-request-5bf7d7d06881dc82a235e9fa8444678d","kind":"ScopeRequest","message":"R1: Positive integers retain their value; zero and negative integers produce zero. K1: Negative boundary.\nAccept only these explicitly requested positive and negative branches. Record unrelated risks as suggestions.","origin":"user","session_id":"installed-runtime","source_event_id":"aea4175c-86b9-4a1a-8aa9-d56c3d9cd789","task_id":"same-task","workspace_id":"sha256:b62dbe56b4691a69b45268f2c10e82cfe97373b23eadb392eef774d7e0c16000"}
